File Name,Clip Directory,Duration TC,,,Resolution,Video Codec,Description,Comments,,Location,Category,,,,,Bit Depth,,,,EDL Clip Name,Camera Type,,,Camera Format,Camera FPS,,,,Sensor,,,,,,Aspect Ratio Notes,License Type,Pricing Tier
A005_D035_0503CO_001.R3D,/Volumes/SSD4TB/Raptor UW 3 May/A005_D035_0503CO.RDC,00:01:16:23,,,5120 x 2700,r3d,"A small group of golden sweepers, Parapriacanthus ransonneti, schooling under a large coral head in Raja Ampat, Indonesia, Pacific Ocean",golden-sweepers-school,,"Raja Ampat, Indonesia",Underwater,,,,,16,,,,,V-RAPTOR 8K VV,,,MQ,32,,,,V-RAPTOR VV,,,,,,1.9,,
A005_D004_05032X_001.R3D,/Volumes/SSD4TB/Raptor UW 3 May/A005_D004_05032X.RDC,00:00:49:22,,,5120 x 2700,r3d,"Eretmochelys imbricata, foraging on the reef in Raja Ampat, Indonesia, Pacific Ocean",hawksbill-turtle-foraging,,"Raja Ampat, Indonesia",Underwater,,,,,16,,,,,V-RAPTOR 8K VV,,,MQ,32,,,,V-RAPTOR VV,,,,,,1.9,,
A008_D001_0507HF_001.R3D,/Volumes/SSD4TB/Raptor UW 7 May/A008_D001_0507HF.RDC,00:01:39:01,,,7680 x 4320,r3d,"A large group of ribboned sweetlips, Plectorhinchus polytaenia, tightly packed together to avoid predators in Raja Ampat, Indonesia, Pacific Ocean",ribbon-sweetlips-school,,"Raja Ampat, Indonesia",Underwater,,,,,16,,,,A008_D001_0507HF_001.R3D,V-RAPTOR 8K VV,,,MQ,32,,,,V-RAPTOR VV,,,,,,1.78,,
A032_C146_0918B1_001.R3D,,00:01:23:03,,,5120 x 2700,r3d,"A large green turtle, Chelonia mydas, swims through a healthy coral garden in the Komodo National Park, Indonesia, Pacific Ocean",green-turtle-swimming-from-above,,"Komodo, Indonesia",Underwater,,,,,16,,,,,DSMC2 GEMINI 5K S35,,,REDcode 5:1,59.94,,,,DSMC2 GEMINI 5K S35,,,,,,1.09,Commercial,Premium
A033_C107_0919KN_001.R3D,,00:00:21:02,,,5120 x 2160,r3d,"Sunset over the waters of Komodo National Park with a traditional phinisi boat silhouetted in the foreground, Komodo National Park, Indonesia, Pacific Ocean",Komodo-scenery-sunset-boat,,"Komodo, Indonesia",Landscape,,,,,16,,,,,DSMC2 GEMINI 5K S35,,,REDcode 4:1,59.94,,,,DSMC2 GEMINI 5K S35,,,,,,2:37,Commercial,Standard
A033_C109_0919S5_001.R3D,,00:00:08:20,,,5120 x 2160,r3d,"Sunset over the waters of Komodo National Park with a traditional phinisi boat in the foreground, Komodo National Park, Indonesia, Pacific Ocean",sunset-komodo-boat-clouds,,"Komodo, Indonesia",Landscape,,,,,16,,,,,DSMC2 GEMINI 5K S35,,,REDcode 4:1,59.94,,,,DSMC2 GEMINI 5K S35,,,,,,2:37,Commercial,Standard
A033_C111_0919KW_001.R3D,,00:00:46:48,,,5120 x 2160,r3d,"Sunset over the waters of Komodo National Park with a speedboat crossing in front of a traditional phinisi boat in the foreground, Komodo National Park, Indonesia, Pacific Ocean",speedboat-crossing-sunset-reflection-sea,,"Komodo, Indonesia",Landscape,,,,,16,,,,,DSMC2 GEMINI 5K S35,,,REDcode 4:1,59.94,,,,DSMC2 GEMINI 5K S35,,,,,,2:37,Commercial,Standard
A033_C080_091838_001.R3D,,00:00:35:19,,,5120 x 2700,r3d,"A small group of dolphins emerging from the water to breathe, Komodo National Park, Indonesia, Pacific Ocean",Small-group-dolphins-emerging-sea,,"Komodo, Indonesia",Marine Life,,,,,16,,,,,DSMC2 GEMINI 5K S35,,,REDcode 8:1,96,,,,DSMC2 GEMINI 5K S35,,,,,,1:09,Commercial,Standar
A033_C081_0918B5_001.R3D,,00:01:50:04,,,5120 x 2700,r3d,"A small group of dolphins emerging from the water to breathe, Komodo National Park, Indonesia, Pacific Ocean",Small-group-dolphins-surfacing,,"Komodo, Indonesia",Marine Life,,,,,16,,,,,DSMC2 GEMINI 5K S35,,,REDcode 8:1,96,,,,DSMC2 GEMINI 5K S35,,,,,,1:09,Commercial,Standard
A033_C082_0918AC_001.R3D,,00:00:42:85,,,5120 x 2700,r3d,"Landscape of the brown islands of Komodo National Park, panning the camera from left to right, Komodo Island, Indonesia, Pacific Ocean",komodo-lanscape-pan-to-right,,"Komodo, Indonesia",Landscape,,,,,16,,,,,DSMC2 GEMINI 5K S35,,,REDcode 8:1,96,,,,DSMC2 GEMINI 5K S35,,,,,,1:09,Commercial,Standard
A033_C083_0918MG_001.R3D,,00:01:54:10,,,5120 x 2700,r3d,"A small group of dolphins emerging from the water to breathe, Komodo National Park, Indonesia, Pacific Ocean",Small-group-dolphins,,"Komodo, Indonesia",Marine Life,,,,,16,,,,,DSMC2 GEMINI 5K S35,,,REDcode 8:1,96,,,,DSMC2 GEMINI 5K S35,,,,,,1:09,Commercial,Standard
A033_C084_0918P8_001.R3D,,00:00:35:03,,,5120 x 2700,r3d,"A small group of dolphins emerging from the water to breathe, Komodo National Park, Indonesia, Pacific Ocean",Small-group-dolphins-surface,,"Komodo, Indonesia",Marine Life,,,,,16,,,,,DSMC2 GEMINI 5K S35,,,REDcode 8:1,96,,,,DSMC2 GEMINI 5K S35,,,,,,1:09,Commercial,Standard
A032_C139_0918JK_001.R3D,,00:01:26:52,,,5120 x 2700,r3d,"A green turtle, Chelonia mydas, swims through the water column backlit with sun rays, Komodo National Park, Indonesia, Pacific Ocean",Turtle-swimming-water-column-sun,,"Komodo, Indonesia",Underwater,,,,,16,,,,,DSMC2 GEMINI 5K S35,,,REDcode 5:1,59.94,,,,DSMC2 GEMINI 5K S35,,,,,,1:09,Commercial,Premium
A032_C140_0918QW_001.R3D,,00:00:54:48,,,5120 x 2700,r3d,"A green turtle, Chelonia mydas, swims behind the coral, Komodo National Park, Indonesia, Pacific Ocean",turtle-swimming-behind-coral,,"Komodo, Indonesia",Underwater,,,,,16,,,,,DSMC2 GEMINI 5K S35,,,REDcode 5:1,59.94,,,,DSMC2 GEMINI 5K S35,,,,,,1:09,Commercial,Premium
A032_C140_0918QW_001.R3D,,00:00:54:48,,,5120 x 2700,r3d,"A green turtle, Chelonia mydas, hiding behind corals, Komodo National Park, Indonesia, Pacific Ocean",turtle-hiding-behind-coral,,"Komodo, Indonesia",Underwater,,,,,16,,,,,DSMC2 GEMINI 5K S35,,,REDcode 5:1,59.94,,,,DSMC2 GEMINI 5K S35,,,,,,1:09,Commercial,Premium
A032_C140_0918QW_001.R3D,,00:00:54:48,,,5120 x 2700,r3d,"Panning around a coral head to reveal a green turtle, Chelonia mydas, as it swims into the water column, Komodo National Park, Indonesia, Pacific Ocean",green-turtle-reveal-from-corals,,"Komodo, Indonesia",Underwater,,,,,16,,,,,DSMC2 GEMINI 5K S35,,,REDcode 5:1,59.94,,,,DSMC2 GEMINI 5K S35,,,,,,1:09,Commercial,Premium
A032_C141_0918U7_001.R3D,,00:02:04:47,,,5120 x 2700,r3d,"A green turtle, Chelonia mydas, swims past a healthy hard coral reef, Komodo National Park, Indonesia, Pacific Ocean",green-turtle-swimming-over-corals-sideview,,"Komodo, Indonesia",Underwater,,,,,16,,,,,DSMC2 GEMINI 5K S35,,,REDcode 5:1,59.94,,,,DSMC2 GEMINI 5K S35,,,,,,1:09,Commercial,Premium
A032_C141_0918U7_001.R3D,,00:02:04:47,,,5120 x 2700,r3d,"A green turtle, Chelonia mydas, swims over a healthy coral reef, Komodo National Park, Indonesia, Pacific Ocean",green-turtle-swimming-over-corals-sideview,,"Komodo, Indonesia",Underwater,,,,,16,,,,,DSMC2 GEMINI 5K S35,,,REDcode 5:1,59.94,,,,DSMC2 GEMINI 5K S35,,,,,,1:09,Commercial,Premium
A032_C144_0918LN_001.R3D,,00:01:06:10,,,5120 x 2700,r3d,"A silhouetted green turtle, Chelonia mydas, swims through the water column backlit with sun rays, Komodo National Park, Indonesia, Pacific Ocean",greenturtle-silohuette-looking-up-bluewater,,"Komodo, Indonesia",Underwater,,,,,16,,,,,DSMC2 GEMINI 5K S35,,,REDcode 5:1,59.94,,,,DSMC2 GEMINI 5K S35,,,,,,1:09,Commercial,Premium
A032_C144_0918LN_001.R3D,,00:01:06:10,,,5120 x 2700,r3d,"A green turtle, Chelonia mydas, swims toward the surface in the late afternoon, Komodo National Park, Indonesia, Pacific Ocean",green-turtle-swimming-up-to-surface,,"Komodo, Indonesia",Underwater,,,,,16,,,,,DSMC2 GEMINI 5K S35,,,REDcode 5:1,59.94,,,,DSMC2 GEMINI 5K S35,,,,,,1:09,Commercial,Premium
A032_C145_0918Y1_001.R3D,,00:00:47:11,,,5120 x 2700,r3d,"A green turtle, Chelonia mydas, gliding in the water column backlit with sun rays, Komodo National Park, Indonesia, Pacific Ocean",green-turtle-from-below-gliding-watercolumn,,"Komodo, Indonesia",Underwater,,,,,16,,,,,DSMC2 GEMINI 5K S35,,,REDcode 5:1,59.94,,,,DSMC2 GEMINI 5K S35,,,,,,1:09,Commercial,Premium
A032_C146_0918B1_001.R3D,,00:01:23:03,,,5120 x 2700,r3d,"A green turtle, Chelonia mydas, swims over sand toward the coral reef, Komodo National Park, Indonesia, Pacific Ocean",green-turtle-swimming-over-sand-to-corals-from-above,,"Komodo, Indonesia",Underwater,,,,,16,,,,,DSMC2 GEMINI 5K S35,,,REDcode 5:1,59.94,,,,DSMC2 GEMINI 5K S35,,,,,,1:09,Commercial,Premium
A032_C145_0918Y1_001.R3D,,00:00:47:11,,,5120 x 2700,r3d,"Following a green turtle, Chelonia mydas, from behind as it swims over a white sandy bottom, Komodo National Park, Indonesia, Pacific Ocean",following-green-turtle-from-behind,,"Komodo, Indonesia",Underwater,,,,,16,,,,,DSMC2 GEMINI 5K S35,,,REDcode 5:1,59.94,,,,DSMC2 GEMINI 5K S35,,,,,,1:09,Commercial,Premium
A032_C147_0918U3_001.R3D,,00:00:38:55,,,5120 x 2700,r3d,"A green turtle, Chelonia mydas, swims over corals from left to right,  Komodo National Park, Indonesia, Pacific Ocean",green-turtle-swimming-over-corals-left-to-right,,"Komodo, Indonesia",Underwater,,,,,16,,,,,DSMC2 GEMINI 5K S35,,,REDcode 5:1,59.94,,,,DSMC2 GEMINI 5K S35,,,,,,1:09,Commercial,Premium
A032_C146_0918B1_001.R3D,,00:01:23:03,,,5120 x 2700,r3d,"A green turtle, Chelonia mydas, swims over a coral reef viewed from above, Komodo National Park, Indonesia, Pacific Ocean",green-turtle-swimming-over-corals-from-above,,"Komodo, Indonesia",Underwater,,,,,16,,,,,DSMC2 GEMINI 5K S35,,,REDcode 5:1,59.94,,,,DSMC2 GEMINI 5K S35,,,,,,1:09,Commercial,Premium
A032_C147_0918U3_001.R3D,,00:00:38:55,,,5120 x 2700,r3d,"A green turtle, Chelonia mydas, swims toward the camera before turning and swimming away, Komodo National Park, Indonesia, Pacific Ocean",green-turtle-front-view-turning-in-front-camera,,"Komodo, Indonesia",Underwater,,,,,16,,,,,DSMC2 GEMINI 5K S35,,,REDcode 5:1,59.94,,,,DSMC2 GEMINI 5K S35,,,,,,1:09,Commercial,Premium
A032_C149_0918FB_001.R3D,,00:00:52:12,,,5120 x 2700,r3d,"Shooting the sun rays diffusing in shallow blue water, Komodo National Park, Indonesia, Pacific Ocean",sunrays-underwater-afternoon,,"Komodo, Indonesia",Underwater,,,,,16,,,,,DSMC2 GEMINI 5K S35,,,REDcode 5:1,59.94,,,,DSMC2 GEMINI 5K S35,,,,,,1:09,Commercial,Premium
A032_C149_0918FB_001.R3D,,00:00:52:12,,,5120 x 2700,r3d,"Sun rays diffusing in shallow blue water, Komodo National Park, Indonesia, Pacific Ocean",sunrays-underwater-late-afternoon,,"Komodo, Indonesia",Underwater,,,,,16,,,,,DSMC2 GEMINI 5K S35,,,REDcode 5:1,59.94,,,,DSMC2 GEMINI 5K S35,,,,,,1:09,Commercial,Premium
A032_C149_0918FB_001.R3D,,00:00:52:12,,,5120 x 2700,r3d,"Diffused sun rays in shallow blue water, Komodo National Park, Indonesia, Pacific Ocean",Sunrays-underwater-afternoon-light,,"Komodo, Indonesia",Underwater,,,,,16,,,,,DSMC2 GEMINI 5K S35,,,REDcode 5:1,59.94,,,,DSMC2 GEMINI 5K S35,,,,,,1:09,Commercial,Premium
A032_C003_0916O6_001.R3D,,00:00:43:41,,,5120 x 2160,r3d,"A moorish idol, Zanclus cornutus, inspects a large red barrel sponge, Xestospongia muta, Komodo National Park, Indonesia, Pacific Ocean",Moorish-idol-fish-in-barrel-sponge,,"Komodo, Indonesia",Underwater,,,,,16,,,,,DSMC2 GEMINI 5K S35,,,REDcode 4:1,59.94,,,,DSMC2 GEMINI 5K S35,,,,,,2:37,Commercial,Premium
A032_C005_0916IW_001.R3D,,00:00:27:52,,,5120 x 2160,r3d,"Healthy soft corals and sponges with tropical fish swarming around them with a white sandy bottom, Komodo National Park, Indonesia, Pacific Ocean",healthy-corals-barrel-sponges,,"Komodo, Indonesia",Underwater,,,,,16,,,,,DSMC2 GEMINI 5K S35,,,REDcode 4:1,59.94,,,,DSMC2 GEMINI 5K S35,,,,,,2:37,Commercial,Premium
A032_C006_0916B8_001.R3D,,00:00:48:40,,,5120 x 2160,r3d,"Moorish idols, Zanius cornutus, and anthias swim around red barrel sponges, Xestospongia muta, Komodo National Park, Indonesia, Pacific Ocean",moorish-idol-group-over-coralhead-barrel-sponges,,"Komodo, Indonesia",Underwater,,,,,16,,,,,DSMC2 GEMINI 5K S35,,,REDcode 4:1,59.94,,,,DSMC2 GEMINI 5K S35,,,,,,2:37,Commercial,Premium
A032_C007_0916DG_001.R3D,,00:00:23:46,,,5120 x 2160,r3d,"A white tip reef shark, Triaenodon obesus, sits under a ledge in the Komodo National Park, Indonesia, Pacific Ocean",white-tip-reef-shark-overhang-wide,,"Komodo, Indonesia",Underwater,,,,,16,,,,,DSMC2 GEMINI 5K S35,,,REDcode 4:1,59.94,,,,DSMC2 GEMINI 5K S35,,,,,,2:37,Commercial,Premium
A032_C008_0916UY_001.R3D,,00:00:16:52,,,5120 x 2160,r3d,"Close up view of a white tip reef shark, Triaenodon obesus, sitting under a ledge in the Komodo National Park, Indonesia, Pacific Ocean",white-tip-reef-shark-overhang-mid,,"Komodo, Indonesia",Underwater,,,,,16,,,,,DSMC2 GEMINI 5K S35,,,REDcode 4:1,59.94,,,,DSMC2 GEMINI 5K S35,,,,,,2:37,Commercial,Premium
A032_C012_0916ZI_001.R3D,,00:00:20:09,,,5120 x 2160,r3d,"Colourful soft corals on a coral head, camera pans up to reveal a canyon in the background, Komodo National Park, Indonesia, Pacific Ocean",Canyon-channel-komodo,,"Komodo, Indonesia",Underwater,,,,,16,,,,,DSMC2 GEMINI 5K S35,,,REDcode 4:1,59.94,,,,DSMC2 GEMINI 5K S35,,,,,,2.37,Commercial,Premium
A032_C013_0916YE_001.R3D,,00:00:15:05,,,5120 x 2160,r3d,"Camera pans up to show colourful corals with a deep canyon filled with fish in the background, Komodo National Park, Indonesia, Pacific Ocean",Canyon-channel-komodo-corals,,"Komodo, Indonesia",Underwater,,,,,16,,,,,DSMC2 GEMINI 5K S35,,,REDcode 4:1,59.94,,,,DSMC2 GEMINI 5K S35,,,,,,2.37,Commercial,Premium
A032_C014_0916N2_001.R3D,,00:00:13:46,,,5120 x 2160,r3d,"Camera pans to the right across colourful soft corals and a large underwater canyon, Komodo National Park, Indonesia, Pacific Ocean",Canyon-channel-komodo-pan,,"Komodo, Indonesia",Underwater,,,,,16,,,,,DSMC2 GEMINI 5K S35,,,REDcode 4:1,59.94,,,,DSMC2 GEMINI 5K S35,,,,,,2.37,Commercial,Premium
A032_C016_0916BO_001.R3D,,00:00:14:05,,,5120 x 2160,r3d,"Several species of fish such as trevally and a white tip reef shark,Triaenodon obesus, are silhouetted while swimming in an underwater canyon. Komodo National Park, Indonesia, Pacific Ocean",white-tip-reef-shark-fish-above-canyon-komodo,,"Komodo, Indonesia",Underwater,,,,,16,,,,,DSMC2 GEMINI 5K S35,,,REDcode 4:1,59.94,,,,DSMC2 GEMINI 5K S35,,,,,,2.37,Commercial,Premium
A032_C015_09167P_001.R3D,,00:00:11:02,,,5120 x 2160,r3d,"A small school of blue fin trevally, Caranx melampygus, swim close to the bottom of a rocky canyon, Komodo National Park, Indonesia, Pacific Ocean",blue-fin-trevallies-canyon-komodo,,"Komodo, Indonesia",Underwater,,,,,16,,,,,DSMC2 GEMINI 5K S35,,,REDcode 4:1,59.94,,,,DSMC2 GEMINI 5K S35,,,,,,2.37,Commercial,Premium
A032_C017_0916CO_001.R3D,,00:00:22:47,,,5120 x 2700,r3d,"Bright pink anthias swim in the current on a reef slope covered in red sea fans, Komodo National Park, Indonesia, Pacific Ocean",anthias-healthy-reef-seafans,,"Komodo, Indonesia",Underwater,,,,,16,,,,,DSMC2 GEMINI 5K S35,,,REDcode 5:1,59.94,,,,DSMC2 GEMINI 5K S35,,,,,,1.09,Commercial,Premium
A032_C021_0916B4_001.R3D,,00:00:46:41,,,5120 x 2700,r3d,"Camera pushes through a school of pink anthias and over a healthy reef full of colourful soft corals, Komodo National Park, Indonesia, Pacific Ocean",angelfish-reef-anthias,,"Komodo, Indonesia",Underwater,,,,,16,,,,,DSMC2 GEMINI 5K S35,,,REDcode 5:1,59.94,,,,DSMC2 GEMINI 5K S35,,,,,,1.09,Commercial,Premium
A032_C022_0916MB_001.R3D,,00:00:41:58,,,5120 x 2700,r3d,"A mixed school of bigeye jacks, Caranx sexfasciatus and blue fin trevally, Caranx melampygus, swimming in a sandy channel, Komodo National Park, Indonesia, Pacific Ocean",bigeye-jackfish-school-reef-sand,,"Komodo, Indonesia",Underwater,,,,,16,,,,,DSMC2 GEMINI 5K S35,,,REDcode 5:1,59.94,,,,DSMC2 GEMINI 5K S35,,,,,,1.09,Commercial,Premium
A032_C030_0916RK_001.R3D,,00:00:32:54,,,5120 x 2160,r3d,"A large mixed school of blue and gold fusiliers, Caesio caerulaurea, and blue streak fusiliers, Pterocaesio tile, swimming right to left, Komodo National Park, Indonesia, Pacific Ocean",fusilliers-sideview-right-to-left,,"Komodo, Indonesia",Underwater,,,,,16,,,,,DSMC2 GEMINI 5K S35,,,REDcode 4:1,59.94,,,,DSMC2 GEMINI 5K S35,,,,,,2.37,Commercial,Premium
A032_C032_091621_001.R3D,,00:00:32:50,,,5120 x 2160,r3d,"Camera pushes forward over a large table coral, Acropora sp., branching corals and leather corals on a sandy bottom, Komodo National Park, Indonesia, Pacific Ocean",huge-acropora-tablecoral,,"Komodo, Indonesia",Underwater,,,,,16,,,,,DSMC2 GEMINI 5K S35,,,REDcode 4:1,59.94,,,,DSMC2 GEMINI 5K S35,,,,,,2.37,Commercial,Premium
A032_C033_0916GP_001.R3D,,00:00:33:57,,,5120 x 2160,r3d,"Camera pushes up and over a healthy hard coral reef with a variety of species of coral and small tropical fish surrounded by a white sand bottom, Komodo National Park, Indonesia, Pacific Ocean",pristine-coralblock-acropora,,"Komodo, Indonesia",Underwater,,,,,16,,,,,DSMC2 GEMINI 5K S35,,,REDcode 4:1,59.94,,,,DSMC2 GEMINI 5K S35,,,,,,2.37,Commercial,Premium
A032_C034_0916MI_001.R3D,,00:00:23:02,,,5120 x 2160,r3d,"Camera pushes up and over a coral head with healthy Acropora sp., table corals and branching corals and a variety of tropical fish, backlit by the sun, Komodo National Park, Indonesia, Pacific Ocean",big-table-corals-acropora,,"Komodo, Indonesia",Underwater,,,,,16,,,,,DSMC2 GEMINI 5K S35,,,REDcode 4:1,59.94,,,,DSMC2 GEMINI 5K S35,,,,,,2.37,Commercial,Premium
A032_C035_0916HL_001.R3D,,00:00:12:01,,,5120 x 2160,r3d,"Healthy hard coral garden with anthias, surgeon and damsel fish swimming above the staghorn branching corals, Acropora sp., Komodo National Park, Indonesia, Pacific Ocean",healthy-diverse-reef-komodo,,"Komodo, Indonesia",Underwater,,,,,16,,,,,DSMC2 GEMINI 5K S35,,,REDcode 4:1,59.94,,,,DSMC2 GEMINI 5K S35,,,,,,2.37,Commercial,Premium
A032_C038_0916EG_001.R3D,,00:01:21:55,,,5120 x 2160,r3d,"A reef manta ray, Mobula alfredi, cruises left to right through a healthy coral reef, Komodo National Park, Indonesia, Pacific Ocean",Reef-manta-cruising-left-to-right-komodo,,"Komodo, Indonesia",Underwater,,,,,16,,,,,DSMC2 GEMINI 5K S35,,,REDcode 4:1,59.94,,,,DSMC2 GEMINI 5K S35,,,,,,2.37,Commercial,Premium
A032_C041_0916ML_001.R3D,,00:00:30:54,,,5120 x 2160,r3d,"A reef manta ray, Mobula alfredi, cruises from left to right over the corals of south Komodo Island as seen from above, Komodo National Park, Indonesia, Pacific Ocean",Reef-manta-cruising-left-to-right-from-above,,"Komodo, Indonesia",Underwater,,,,,16,,,,,DSMC2 GEMINI 5K S35,,,REDcode 4:1,59.94,,,,DSMC2 GEMINI 5K S35,,,,,,2.37,Commercial,Premium
A032_C044_0916DQ_001.R3D,,00:00:44:53,,,5120 x 2160,r3d,"Camera pushes forward over a healthy hard and soft coral reef with a variety of damselfish, butterfly fish and anthias swimming in front of a red sea fan, Komodo National Park, Indonesia, Pacific Ocean",afternoon-light-coral-reef-komodo,,"Komodo, Indonesia",Underwater,,,,,16,,,,,DSMC2 GEMINI 5K S35,,,REDcode 4:1,59.94,,,,DSMC2 GEMINI 5K S35,,,,,,2.37,Commercial,Premium
A032_C045_09164T_001.R3D,,00:00:43:46,,,5120 x 2160,r3d,"Healthy shallow coral reef in afternoon light with a variety of damselfish and anthias swimming in the water column, Komodo National Park, Indonesia, Pacific Ocean",afternoon-light-coral-reef,,"Komodo, Indonesia",Underwater,,,,,16,,,,,DSMC2 GEMINI 5K S35,,,REDcode 4:1,59.94,,,,DSMC2 GEMINI 5K S35,,,,,,2.37,Commercial,Premium
A032_C046_09166R_001.R3D,,00:01:03:04,,,5120 x 2160,r3d,"Close up pushing past a red sea fan in afternoon light with tropical fish in the water column, Komodo National Park, Indonesia, Pacific Ocean",red-seafan-coral-reef-komodo,,"Komodo, Indonesia",Underwater,,,,,16,,,,,DSMC2 GEMINI 5K S35,,,REDcode 4:1,59.94,,,,DSMC2 GEMINI 5K S35,,,,,,2.37,Commercial,Premium
A030_C031_0915A2_001.R3D,,00:01:21:52,,,5120 x 2160,r3d,"A small group of blackfin or chevron barracuda, Sphyraena qenie, swimming near the bottom, Komodo National Park, Indonesia, Pacific Ocean",barracuda-small-group-near-bottom-reef,,"Komodo, Indonesia",Underwater,,,,,16,,,,,DSMC2 GEMINI 5K S35,,,REDcode 4:1,59.94,,,,DSMC2 GEMINI 5K S35,,,,,,2.37,Commercial,Premium
A030_C006_0915PE_001.R3D,,00:00:16:00,,,4800 x 2700,r3d,"A school of circular spadefish or batfish, Platax orbicularis, swim along a rubble bottom, Komodo National Park, Indonesia, Pacific Ocean",Batfish-spadefish-swimming_close_to_bottom,,"Komodo, Indonesia",Underwater,,,,,16,,,,,DSMC2 GEMINI 5K S35,,,REDcode 5:1,59.94,,,,DSMC2 GEMINI 5K S35,,,,,,"0,095833333",Commercial,Premium
A030_C008_0915OM_001.R3D,,00:00:47:10,,,4800 x 2700,r3d,"A school of pinnate spadefish or batfish, Platax pinnatus, grouped near a seafan on a coral reef, Komodo National Park, Indonesia, Pacific Ocean",batfish-spadefish-hanging-by-seafan,,"Komodo, Indonesia",Underwater,,,,,16,,,,,DSMC2 GEMINI 5K S35,,,REDcode 5:1,59.94,,,,DSMC2 GEMINI 5K S35,,,,,,"0,095833333",Commercial,Premium
A030_C013_0915EE_001.R3D,,00:00:19:12,,,4800 x 2700,r3d,"A small school of blue streak fusiliers, Pterocaesio tile, swim over a table coral, Acropora sp., Komodo National Park, Indonesia, Pacific Ocean", fusilliers-near-acropora,,"Komodo, Indonesia",Underwater,,,,,16,,,,,DSMC2 GEMINI 5K S35,,,REDcode 5:1,59.94,,,,DSMC2 GEMINI 5K S35,,,,,,"0,095833333",Commercial,Premium
A030_C015_09154U_001.R3D,,00:00:43:01,,,4800 x 2700,r3d,"Camera pushes through a school of blue streak fusiliers, Pterocaesio tile, swimming over a bare current swept bottom, Komodo National Park, Indonesia, Pacific Ocean",school-of-fusilliers-near-bottom,,"Komodo, Indonesia",Underwater,,,,,16,,,,,DSMC2 GEMINI 5K S35,,,REDcode 5:1,59.94,,,,DSMC2 GEMINI 5K S35,,,,,,"0,095833333",Commercial,Premium
A030_C016_09154R_001.R3D,,00:00:10:48,,,4800 x 2700,r3d,"Panning from right to left across a school of blue streak fusiliers, Pterocaesio tile, Komodo National Park, Indonesia, Pacific Ocean",school-of-fusilliers-near-reef,,"Komodo, Indonesia",Underwater,,,,,16,,,,,DSMC2 GEMINI 5K S35,,,REDcode 5:1,59.94,,,,DSMC2 GEMINI 5K S35,,,,,,"0,095833333",Commercial,Premium
A030_C037_0915C8_001.R3D,,00:00:19:04,,,5120 x 2160,r3d,"Following a school of blackfin or chevron barracuda, Sphyraena genie, in the water column, Komodo National Park, Indonesia, Pacific Ocean",following-barracuda-group-from-behind,,"Komodo, Indonesia",Underwater,,,,,16,,,,,DSMC2 GEMINI 5K S35,,,REDcode 4:1,59.94,,,,DSMC2 GEMINI 5K S35,,,,,,2.37,Commercial,Premium
A030_C039_0915LN_001.R3D,,00:00:38:03,,,5120 x 2160,r3d,"A school of blackfin or chevron barracuda, Sphyraena genie, with fusiliers and surgeonfish in the water column, Komodo National Park, Indonesia, Pacific Ocean",barracuda-group-swimming-upward,,"Komodo, Indonesia",Underwater,,,,,16,,,,,DSMC2 GEMINI 5K S35,,,REDcode 4:1,59.94,,,,DSMC2 GEMINI 5K S35,,,,,,2.37,Commercial,Premium
A030_C043_0915A9_001.R3D,,00:01:07:53,,,5120 x 2160,r3d,"A school of blackfin or chevron barracuda, Sphyraena genie, in the blue water, Komodo National Park, Indonesia, Pacific Ocean",barracuda-group-blue-water-sideview-right-to-left,,"Komodo, Indonesia",Underwater,,,,,16,,,,,DSMC2 GEMINI 5K S35,,,REDcode 4:1,59.94,,,,DSMC2 GEMINI 5K S35,,,,,,2.37,Commercial,Premium
A030_C041_0915DQ_001.R3D,,00:00:17:38,,,5120 x 2160,r3d,"A school of blackfin or chevron barracuda, Sphyraena genie, silhouetted against the surface, Komodo National Park, Indonesia, Pacific Ocean",compact-barracuda-group-blue-water,,"Komodo, Indonesia",Underwater,,,,,16,,,,,DSMC2 GEMINI 5K S35,,,REDcode 4:1,59.94,,,,DSMC2 GEMINI 5K S35,,,,,,2.37,Commercial,Premium
A030_C042_0915IH_001.R3D,,00:00:21:49,,,5120 x 2160,r3d,"A school of blackfin or chevron barracuda, Sphyraena genie, swim in shallow blue water, Komodo National Park, Indonesia, Pacific Ocean",compact-barracuda-group-blue-water_front_view,,"Komodo, Indonesia",Underwater,,,,,16,,,,,DSMC2 GEMINI 5K S35,,,REDcode 4:1,59.94,,,,DSMC2 GEMINI 5K S35,,,,,,2.37,Commercial,Premium
A030_C045_09156T_001.R3D,,00:00:50:51,,,5120 x 2160,r3d,"Camera pushes forward over a healthy stand of branching coral, Acropora sp., with resident anthias and damselfish, Komodo National Park, Indonesia, Pacific Ocean",small-anthias-over-coral-reef,,"Komodo, Indonesia",Underwater,,,,,16,,,,,DSMC2 GEMINI 5K S35,,,REDcode 4:1,59.94,,,,DSMC2 GEMINI 5K S35,,,,,,2.37,Commercial,Premium
A030_C048_091548_001.R3D,,00:01:08:59,,,5120 x 2160,r3d,"A healthy shallow coral reef full of branching Acropora corals, Komodo National Park, Indonesia, Pacific Ocean",swimming-over-healthy_acropora,,"Komodo, Indonesia",Underwater,,,,,16,,,,,DSMC2 GEMINI 5K S35,,,REDcode 4:1,59.94,,,,DSMC2 GEMINI 5K S35,,,,,,2.37,Commercial,Premium
A030_C049_09154F_001.R3D,,00:00:18:14,,,5120 x 2160,r3d,"Anthias and damselfish hover above a large Acropora table coral, Komodo National Park, Indonesia, Pacific Ocean",acropora-small-fishes,,"Komodo, Indonesia",Underwater,,,,,16,,,,,DSMC2 GEMINI 5K S35,,,REDcode 4:1,59.94,,,,DSMC2 GEMINI 5K S35,,,,,,2.37,Commercial,Premium
A030_C051_0915ME_001.R3D,,00:00:29:04,,,5120 x 2160,r3d,"Schools of tropical fish such as anthias and damselfish swarm the water column above a healthy reef of branching hard corals, Komodo National Park, Indonesia, Pacific Ocean",orbit-over-healthy-diverse-reef,,"Komodo, Indonesia",Underwater,,,,,16,,,,,DSMC2 GEMINI 5K S35,,,REDcode 4:1,59.94,,,,DSMC2 GEMINI 5K S35,,,,,,2.37,Commercial,Premium
A030_C058_09158G_001.R3D,,00:02:24:49,,,5120 x 2160,r3d,"A reef manta ray, Mobula alfredi, swims past the camera showing its white belly with a remora attached, Komodo National Park, Indonesia, Pacific Ocean",manta-showing-belly,,"Komodo, Indonesia",Underwater,,,,,16,,,,,DSMC2 GEMINI 5K S35,,,REDcode 4:1,59.94,,,,DSMC2 GEMINI 5K S35,,,,,,2.37,Commercial,Premium
A030_C059_09157Z_001.R3D,,00:05:51:40,,,5120 x 2160,r3d,"A reef manta ray, Mobula alfredi, swims in the blue water column, Komodo National Park, Indonesia, Pacific Ocean",manta-wingspan-from-above,,"Komodo, Indonesia",Underwater,,,,,16,,,,,DSMC2 GEMINI 5K S35,,,REDcode 4:1,59.94,,,,DSMC2 GEMINI 5K S35,,,,,,2.37,Commercial,Premium
A032_C107_0917B5_V1-0072.mp4,,00:00:40:91,,,5120 x 2700,r3d,"A local boatbuilder with a cigarette in his mouth walks down a ladder from a boat he is building, Sangeang Island, Sumbawa, Indonesia. No MR",tight-shot-boat-builder-going-down-ladder,,"Sumbawa, Indonesia",Culture,,,,,16,,,,,DSMC2 GEMINI 5K S35,,,REDcode 8:1,96,,,,,,,,,,1.09,Editorial,Standard
